{
  "jobId": "be089e95-8987-4d10-a1c0-89525f431906",
  "revision": 1,
  "url": "https://jobs.example/postings/fernwood-staff-swe",
  "capturedAt": "2026-09-20T14:03:11.000Z",
  "extractorVersion": "extractor@0.1.0",
  "contentHash": "1400ef076cbc61d627c74a040b5bcd298c97e538aa181516daa5df9cf8c11044",
  "text": "Staff Software Engineer — Fernwood\n\nFernwood is hiring a Staff Software Engineer to help lead our platform team. You will own reliability for our core services and mentor senior engineers.\n\nRequirements:\n- 8+ years of backend engineering experience\n- Experience leading platform or infrastructure teams\n- Strong distributed systems fundamentals\n\nFernwood offers competitive pay and full remote work.",
  "structured": {
    "title": "Staff Software Engineer",
    "company": "Fernwood",
    "location": "Remote",
    "requirements": [
      "8+ years of backend engineering experience",
      "Experience leading platform or infrastructure teams",
      "Strong distributed systems fundamentals"
    ]
  }
}
